Article,Incident Name,Shooter Race,Title
"Editor's Note Appended

SAN YSIDRO, Calif., July 18— An unemployed security guard armed with three guns strode into a McDonald's restaurant in this town on the Mexican border today and killed 20 people and wounded 16 others before a police sharpshooter shot him dead.

The dead included customers at the McDonald's, several of them children, and a number of employees.

Sgt. Robert Nunley of the police said the gunman, carrying a bag of ammunition, had ordered those in the restaurant to lie prone. When an employee picked up a telephone to call the police, the gunman began firing at those on the floor. Later, he fired indiscriminately at adults and children outside the restaurant.

''It's an absolute massacre,'' said Comdr. Larry K. Gore. ''It's a total disaster inside the facility.''

He Had Recently Lost a Job

The gunman was identified by the San Diego police as James Oliver Huberty, 41 years old, of San Ysidro. Sergeant Nunley said Mr. Huberty was married, with two children, and had moved to San Ysidro from Ohio seven months ago. The San Diego Police Chief, Bill Kolender, said Mr. Huberty was dismissed from a job as a security guard at a condominium a few days ago.

Mr. Kolender said Mr. Huberty was wearing fatigue trousers and a dark shirt at the time of the shootings.

Mr. Huberty's wife, who was not immediately identified, was being questioned by the police tonight.

Toll May Be Largest for a Day

United Press International said an initial check of its records showed that the killings were the largest toll by a single gunman in a single day in the nation's history. In 1966, Charles J. Whitman killed 16 people and wounded 31 when he fired from atop a tower on the campus of the University of Texas in Austin.

The gunman apparently opened fire inside the restaurant about 4 P.M. The police said he was armed with a semi-automatic rifle, a shotgun and a pistol and withstood a police siege for more than an hour.

One unidentified witness said: ''Even people on the floor were moaning. He would go through the crowd picking them off one by one. Even children on bicycles were gunned down as they tried to ride to safety.'' The gunman's motive was not immediately known. A San Diego police officer, Arthur Velasquez, one of the first at the scene, said an injured person had told him the gunman yelled ''that he had killed many in Vietnam and he wanted to kill more.''

However, Sergeant Nunley said there was no confirmation of that report.

The restaurant, on a two-lane road parallel to Interstate 5, is just north of the Mexican border and 16 miles south of downtown San Diego. It is surrounded by small businesses, a post office, a bank and several houses.

Officer Velasquez said that when he arrived, ''the suspect was firing everywhere, at anything that moved.'' He added: ''I saw bodies lying outside, adults and children. Some were still alive. I sadly witnessed him killing a man laying next to his wife who had already been shot.''

Some of the dead and wounded were said to be children in a McDonald's playground next to the restaurant.

Seventeen of the bodies, including the assailant's, were inside the restaurant and four were outside.

Commander Gore said the gunman ''was shooting everything that was in sight, including a victim on the freeway, several people outside the restaurant, 10 or 11 inside the facility.''

''I'm told that he came into the restaurant carrying rifles and just began shooting - everything he could shoot. It's just a tragic, tragic scene here.'' 3 Hospitals Treat Wounded

The wounded were taken to at least three hospitals. Stacy Rosebrough, a spokesman for Bay Hospital Medical Center in nearby Chula Vista, said seven of the wounded were at Bay Hospital, all in fair condition or better.

Two of the wounded there were identified. Juan Acosta, 33, of Tijuana, Mexico, suffered gunshot wounds in the left knee and arms and was said to be in fair condition. Felix Astalfo, 26, of San Diego, sustained minor injuries of the chest and neck.

Vera Brewer, nursing supervisor at University of California San Diego Hospital, said three persons were admitted at that hospital. Maricela Flores, 23, of San Diego, was in critical condition with wounds of the face, chest and pelvis. Ronald Herrera, 25, of Orange, Calif., was in critical condition with neck and chest wounds. An unidientified woman was in critical condition with a wound in the head.

Miss Brewer said the hospital was receiving many calls from people who believed their friends or relatives were at the restaurant at the time of the shooting.

Robert Boland, a spokesman for Community Hospital in Chula Vista, said his hospital had received five of the wounded. Francisco Lopez, 22, of San Ysidro, and Guadalupe del Rio, 24, of Tijuana, suffered gunshot wounds and were treated and released.

An 11-year-old boy and an 11-year-old girl, whose names were withheld, also suffered gunshot wounds and were admitted at the hospital. An unidientified baby of 4 to 6 months old who was reportedly passed to a bystander by her wounded mother was taken to the hospital with scattered gunshot wounds and was listed in stable condition.

The police went to the scene after getting a report that a child had been killed outside the restaurant. Mike Rosario, the first officer on the scene, summoned help and several police cars quickly arrived.

More than 10 police officers crouched behind their cars as the gunman kept picking out targets.

''I could see the suspect walking back and forth,'' said Officer Velasquez. ''He'd been shooting several rounds off at a time.'' Slain by Special Police Team

The siege did not end until a police special weapons and tactics team arrived. The team was immediately given a ''green light'' to shoot the gunman, Officer Velasquez said. A police sharpshooter, firing a rifle from the roof of the post office next door to the restaurant, fired the shot that killed the gunman.

Chief Kolender described the scene as a ''sickening massacre,'' adding, ''It's the most terrible thing I've ever seen in my life, and I've been in the business 28 years.''

The gunman evidently spared some of the customers inside the restauarnt. Officer Velasquez estimated that 30 people were inside the restaurant when the shooting began.

''It was terrible,'' said one of the survivors, a McDonald's employee. ''If anybody moved, he just shot them.''

All the windows in the restaurant were shot out. Emergency workers removed several bodies from inside the restaurant and took survivors to a nearby building for emergency treatment.

photo of destruction (page A24); photo of police officer and victim",San Ysidro McDonalds,White,COAST MAN KILLS 20 IN RAMPAGE AT A RESTAURANT
"GODDARD, Kan., Jan. 22— Flags flew at half-staff today over the little white City Hall, at the Post Office and at Goddard Junior High School, where a troubled youth shot a popular school principal to death Monday and wounded three other people.

The school was closed today, and at least one concerned parent closed his shop to remain home with his teen-age children. A ground-breaking for a new grocery store went on as scheduled, but those present wore sorrowing and worried expressions.

The sorrow was over the death of James McGee, slain in a shooting spree by a youth identified by the police as James Alan Kearbey, 14 years old.

The worry was over why it had happened, especially in the school system that is the community's proudest feature, and over its effect on the quiet town of 1,400 people, to which many had moved to escape urban fears.

'Shocked and Stunned'

''Just shocked and stunned - that's all we can say,'' said Kent Hixon, Goddard's 29-year-old, part-time city administrator. ''Things like this just don't happen here. People move here to get in this school district. They are people who want good schools and are willing to pay for them.''

Late today the Kearbey youth was charged with first-degree murder. Under Kansas law, he will have to be tried, however, as a juvenile offender, and the maximum penalty would be a prison sentence lasting no longer than his 21st birthday.

Goddard, once a farming community, is now mainly occupied by commuters with jobs in Wichita, about 12 miles away.

The shootings occurred Monday as the youth walked into the school carrying a rifle and a pistol, according to witnesses, who said he opened fire when he was accosted, first by a teacher, Dawn Swearingen, and the principal, and then by another teacher, Donald Harris, who was walking down a hall with a 14-year-old student, Daniel Williams. All four were struck by rifle bullets, Mr. McGee fatally.

Mrs. Swearingen suffered superficial scalp wounds. Mr. Harris was shot in the hip and the student was wounded in a thigh.

Rifle, Pistol and Ammunition

After a search, the Kearbey youth was arrested in a nearby wheat field. The police said he was carrying a rifle, a pistol and a pocketful of ammunition.

The police here have refused to discuss a possible motive, and most townspeople today remained puzzled over a possible reason for the shooting spree.

But one of those wounded, Mr. Harris, while refusing to be interviewed in person, described the youth in a telephone conversation from the hospital.

The Kearbey youth, whom classmates call Alan, is a boy of superior intelligence, reflected in vocabulary and other tests, Mr. Harris said, but an underachiever for lack of study.

He is a ''loner,'' Mr. Harris said, a boy of slight build, quick to anger and often teased by classmates.

''And things seemed to bother him longer than they would others,'' he said. ''The other kids picked up on that.'' Yet, Mr. Harris said, ''This year in the ninth grade he seemed to show more control.''

''We had just finished a passage on medieval castles and battles,'' Mr. Harris said, ''and Alan seemed really enamored of that. He seemed wrapped up in weapons. He liked talking about the military.''

Still, Mr. Harris said, he was surprised when he met Alan, carrying a rifle, in the school's hall. Then the boy knelt to aim, he said.

'This Can't Be Real'

''I was scared to death,'' Mr. Harris said. ''I looked down the barrel of that gun, and I thought, 'This can't be real.' ''

Still, he said, he is convinced that, from the position his assailant had assumed, he could have fired accurately enough to kill him and the student rather than inflicting flesh wounds.

A conflict with classmates that had become more violent than those described by Mr. Harris occurred late last week, according to Deanna Hall, a high school student who lives across the street from the home of Alan's parents, Wayne and Mary Kearbey.

The boy had been beaten by two classmates in a locker-room fight, she said.

Miss Hall's younger brother, Doug, 13, cited incidents in which Alan had become fiercely angry, including a snowball fight in which he had been hit after falling.

''But most of the time he is a kind of shy kid, a loner,'' said their father, Leroy Hall, who had closed his automotive shop today.

Mr. Hall described the Kearbey family as ''real nice people.''

''There must have been a point where something snapped,'' he said.

Mr. Hall described Wayne Kearbey as an amiable neighbor, a former marine who is now a vocational schoolteacher who collects guns as a hobby.

The Kearbey family had left their home today, but Mr. Kearbey was clearly pained when reached by telephone early this morning before his departure.

''We're terribly sorry,'' he said. ''Words can't express how we feel.''

Asked if he knew a reason for his son's actions, he responded: ''I have several ideas. It's been an ongoing type of thing. It will all come out eventually.'' He declined further comment.

Mr. Hixon, the city administrator, said that ''you could see the pain in those parents eyes'' when they arrived at the City Hall police station after their son's arrest.

Others here, such as Mayor Francis Langton and two City Council members, Lynn Aaron and John Hoisington, voiced their concerns after today's ground-breaking.

''It's put a numb feeling in the whole community,'' said Mr. Aaron.

''This is a town where you don't even have to lock your doors,'' said Mr. Hoisington. ''You don't know why this happened. You know it's an isolated thing, and yet you still feel guilty, like maybe somehow it could have been prevented.''

Later, at a news conference in a Wichita hospital, Dawn Swearingen's husband, Paul, told reporters to remember that ''this is a loving community.'' He added:

''We want to convey our forgiveness to the boy. This is a boy in need of help.''

photo of James Alan Kearbey; photo of Kent Hixon",Goddard Junior High School,White,QUIET WICHITA SUBURB IS BEWILDERED BY KILLING OF POPULAR PRINCIPAL
NaN,Atlanta Post Office,,NaN
"SEATTLE, Feb. 19— Twelve men and a woman were shot dead Friday night in a Chinatown gambling club, apparently in a robbery attempt, the police said today.

The violence at the Wah Mee Club was the largest mass killing in the modern history of the Pacific Northwest. Eleven bodies were found tied hand and foot with nylon cord, and a man's unbound body was found in the office of club, which has operated since the 1940's. One of the victims inside was still alive, but died at Harborview Medical Center.

Two men were in police custody for investigation and a third was questioned, but none have been charged. The men being held were Benjamin Ng, 20 years old, and Kwan Fai Mack, 19. Mr. Ng was arrested at his home, and Mr. Mack called the police and surrendered. The third man was questioned because he was with Mr. Mack when he surrendered.

''We believe that it is robbery,'' Police Maj. Dale Douglass said, adding ''I don't believe it was nickel and dime.'' He said that two search warrants were executed and that ''a good deal of evidence was recovered.'' ''From my knowledge of those places, they had to be admitted by someone who knew them,'' Major Douglass said of the gambling clubs that have flourished here for years despite their illegality.

''This is a unique and horrible incident,'' Police Chief Patrick Fitzsimons said of the carnage. ''I have seen nothing like it before. A case like this is shocking.''

The medical examiner's office listed the names of nine of the victims, all of whom were Seattle residents of Chinese ancestry. They were John Loui, no age given; Chong L. Chinn, no age; Wing Wong, 59; Moo Min Mar, 52; Jean Mar, 47; Henning Chinn, 52; Dewey Mar, no age; Gim Lun Wong, no age, and Hung Fat Gee, about 50. Four unidentified Chinese men, ranging in age from the 30's to the 70's, were also killed. Some Victims Shot Twice

''Some were shot once, some twice,'' Dr. Harry Bonnell, assistant medical examiner for King County, said of the victims, all of whom were shot in the head.

The bodies were found soon after midnight. A passer-by, whose name was not disclosed, called the police at 12:44 A.M. to report finding a greviously wounded man staggering in Maynard Alley South, the littered, cluttered passageway that gives access to the club's door.

The police said the club door had a lock that automatically engaged and could only be opened from the inside, where an attendant in a cage was always on duty. After the wounded man had pushed himself out, the door locked behind him. Door Broken Down

The police broke down the door and found the bodies. There was no indication of a struggle, Captain Mike Slessman said. But dominoes were scattered around the room. He said this indicated that the victims had been playing Paykyo, a gambling game favored by many Orientals here.

Only people of Chinese ancestry were allowed in the club and had to be recognized to gain entry, said Captain Slessman, indicating that the victims may have known their assailants. The door attendant was one of those bound and killed, the authorities said.

Captain Slessman said it appeared that more than one handgun was used in what he said appeared to be a methodical series of killings. The wounded victim was still alive today. He had been interviewed by the police, and was under heavy police guard. 'He Is Our Best Lead'

''He is our best lead,'' said Gary Flynn, a Police Department spokesman. Captain Slessman said it appeared that more than one handgun was used in what he said appeared to be a methodical series of killings. There were no billfolds or other means of rapid identification on any of the bodies. The gambling clubs are a longtime problem, according to Mr. Fitzsimons, the Chief. ''Their history is well known and they've been in operation for over 25 years so there are chronic problems that we deal with as well as we can when the law allows,'' he said. ''We follow very strictly the law, and if we have opportunity to take legal enforcement action we do it. But we always have to have the evidence or the probable cause we need to get search warrants.''

Mr. Flynn said the club was last raided by the police in 1972. A Narrow Passage

The Wah Mee Club is on Maynard Alley South, a narrow passage it shares with a tropical fish and bird importing company that was open today.

The back doors of Chinese stores and restaurants open on Maynard Alley, and their front doors on more pleasant streets. The alley is littered with cardboard boxes, which were disintegrating in the rain today, and wooden cases.

The King Dome, the sports arena, and King County Court, the Seattle police headquarters, and many Oriental restaurants and businesses are nearby. The area is known here as the International District. Once Chinese were its exclusive residents, but in recent years new immigrants of Oriental extraction have settled in the district.

Entrance to the gambling clubs is through double doors, which were secured today with chain and a police padlock. To the right of the door is the attendant's cage where visitors could be scrutinized before they were admitted. Incidents in Chinatowns

The slayings were the latest of several violent incidents that have occurred in the country's Chinatown communities in recent years. In New York City, last Dec. 23 masked gunmen burst into a Chinatown restaurant, reputed to be a gang hangout, and fired wildly into the crowd of customers, killing three people and injuring eight others. The authorities said it was the worst outbreak of gang violence in New York's Chinatown in recent years.

In 1977 a popular restaurant in San Francisco's Chinatown, the Golden Dragon, was the scene of a sudden and brutal attack. Three men wearing ski masks walked into the restaurant shortly before closing time and fired, seemingly indiscriminately, at about 75 latenight diners, killing five people and wounding 11 others.

Illustrations: photo of a body being removed from the private club in Seattle",New York Techincal College,African American,13 SLAIN AT CLUB IN SEATTLE'S CHINATOWN
"The college student accused of killing one person and seriously wounding four others Tuesday in a shooting rampage on a Brooklyn campus was a loner who spent some time in a Georgia mental institution and kept his distance from people, his family and neighbors said yesterday.

''He had no girlfriends, no male friends, no visitors, no cousins, no dog, no cat, no bird,'' said Reginald Walker, a frequent visitor to the building at 718 Putnam Avenue in the Bedford-Stuyvesant section of Brooklyn where the suspect, Van Hull, lived.

''He walked around shell-shocked all the time,'' Mr. Walker said, ''so everybody here just stayed out of his way.''

The shootings appeared to be related to a dispute over $717 in financial aid from New York Technical College, where Mr. Hull has been a student since 1981, the police and the college said. According to the police, Mr. Hull apparently spent even more than that - $750 - for a round-trip bus ticket to Augusta, Ga., and two pistols bought there Monday.

Guns Bought at Pawn Shop

Mr. Hull had the pistols, a .38-caliber revolver and a 9-millimeter automatic, with him when he was arrested.

A police spokesman, Capt. Michael Julian, said detectives had determined that Mr. Hull left New York Sunday on a Trailways bus, bound for Augusta, Ga., where he had lived with his grandmother until he was 9 years old.

On Monday, a man fitting Mr. Hull's description showed up at an Augusta pawn shop and bought the two guns. The police said Mr. Hull arrived back in New York on Tuesday and apparently went straight to the college campus. He had $95 in cash when he was arrested.

''We can only surmise what his motive was - apparently he was angry at some people he felt owed him money,'' Captain Julian said. ''It doesn't seem rational to spend over $700 to travel for the purchase of guns when you're only going to get a $700 check.''

On Tuesday, according to the police, Mr. Hull shot five people - one fatally - on a rampage through the campus of New York City Technical College in downtown Brooklyn. He kept the police at bay, twice exchanging gunfire, before surrendering.

Residents of the building in which Mr. Hull lived, a four-story brown row house on a quiet block in the heart of Bedford-Stuyvesant, said he had last been seen in the building Saturday. That day, as usual, he went by a group of neighborhood residents clustered on the front steps without acknowledging their presence. Avoided His Neighbors

''He didn't speak to anybody, but then again, he never did,'' said Tanya McGriff, 19, who lives on the building's ground floor.

Mr. Walker, 25, who is the boyfriend of Beverly Porter, a woman who lived in the apartment above Mr. Hull and went to school with him, said Mr. Hull had indicated when he moved into the building that he was a part-time musician who played guitar in a band. But Mr. Walker said Mr. Hull spent most of his time alone in his apartment, which Mr. McGriff said had no television or telephone.

''He'd get off the Halsey Street bus, walk straight in the door, and that was the last anyone would see or hear of him,'' Mr. Walker said. ''We knew from seeing the trash he put out that he didn't drink no beer, and we sure didn't smell any reefer or crack coming out of his apartment either.''

Occasionally, Mr. Hull traveled seven blocks to visit his mother, Ruby Banks, at 318 Madison Street in the Bedford-Stuyvesant section, where she lived for nine years until moving last week. Residents of that neighborhood said they had been struck by the marked difference of personality between mother and son.

''She is a very fine person, so outgoing and warm and understanding,'' said Lurline de Shield, who lived next door to Mr. Hull's mother and was her landlady. ''He didn't say anything to anybody, he just seemed to be into himself, really introverted.''

Mr. Hull's grandmother, Gussie Allen, with whom he lived in Augusta, Ga., until he was 9 years old, said her grandson had been a patient at a Georgia mental institution, the Georgia Regional Hospital, in 1981. This was confirmed by a source at the hospital.

Mr. Hull is ''very intelligent,'' but ''disturbed,'' his grandmother said.

Mr. Hull attended the Immaculate Conception School in Augusta before moving to New York, his grandmother said.

He graduated from Andrew Jackson High School in Queens in 1976, and, according to college records, studied nursing at Augusta (Ga.) College before enrolling at New York Technical College, a branch of the City University of New York. College Degree Earned

In 1984, Mr. Hull received an associate of applied science degree in construction technology at the Brooklyn school, said Dr. Emilie Cozzi, director of college relations there. At the time of the shooting, Mr. Hull was enrolled for a second associate degree, this one in civil engineering technology.

Dr. Cozzi said Mr. Hull had an average of about D plus in his civil engineering courses but was not on probation.

According to Dr. Cozzi, Mr. Hull had a $717 check for a Government-backed guaranteed student loan waiting for him for the semester beginning next month. ''He was not deprived of it,'' she said.

''He often had problems with his financial aid, and it usually was traced back to some inaccuracy in his completion of some financial aid forms,'' said the associate dean of student affairs at the college, Rufus K. Newlin.

Dr. Cozzi said that Mr. Hull had worked in the ophthalmic dispensing department as a clerical aide earlier this year, earning the minimum wage. But she added that Scott Riesenberg, the 31-year-old ophthalmology lab technician who died in the shooting, ''had nothing to do'' with approving payments to Mr. Hull.

Police said that Mr. Hull knew both Mr. Riesenberg and Lamont Pittman, the school's financial aid director, who was wounded in the attack and remained hospitalized last night in serious condition, and had selected them as targets.

Mr. Riesenberg, father of a 7-week-old son, lived with his wife, Rhonda, 30, in Yonkers and operated an optical shop in the Bronx with his wife in addition to teaching at the college.

In addition to Mr. Pittman, 43, the wounded and their conditions were Betty Holden of Brooklyn, a security guard for Wells Fargo who worked at the college, who was shot in the face and in fair condition; Elena Vasquez, 32, of Brooklyn, a student and employee of the college, wounded in the left shoulder and chest and in critical condition, and Elaine Harper, 41, who had a head wound and was in serious condition. All were in Long Island College Hospital.

photo of Van Hull (UPI) (page B7)",New York Techincal College,African American,STUDENT CHARGED IN KILLING ON CAMPUS IS CALLED LONER
