Article,Incident Name,Shooter Race,Title
"WINNETKA, Ill., May 21— The Federal Bureau of Investigation knew about Laurie Wasserman Dann. So did prosecutors in three states. So did her neighbors and her former husband and in-laws.

Prosecutors were trying to track her down and charge her with making harassing telephone calls and threats as she became increasingly disturbed. But they lost a race with time. On Friday, the 30-year-old woman set fire to the house where she worked as a baby sitter, went to an elementary school and shot six children, killing one, then wounded a 20-year-old man in a nearby house and barricaded herself there.

The nine-hour ordeal ended Friday night when police discovered that Ms. Dann had fatally shot herself. Poisonings Are Suspected

The authorities said today they believe that before Friday's attack, Ms. Dann delivered marshmallow and rice cereal snacks tainted with arsenic to two fraternity houses at Northwestern University in Evanston. Several students who ate the snacks at the Alpha Tau Omega and Psi Upsilon fraternities became ill.

The police said Ms. Dann also may have tried to poison members of several families for whom she once had worked.

''The situation with Laurie has not ended,'' said Herbert Timm, police chief of Winnetka, referring to the reconstruction of events on the day of the shootings.

Chief Timm said that before the shooting, Ms. Dann dropped off fruit drinks at the doors of six houses where she once worked as a baby sitter in the Chicago suburbs of Glencoe, Highland Park and unincorporated Winnetka. One girl who drank the fruit drink became ill, but she was never taken to a hospital.

Laboratory tests showed that the juice contained arsenic, said Sgt. Gene Kalvaitis of the Winnetka police. He said he did not know how much arsenic was in the juice.

At Ms. Dann's apartment in Madison, Wis., authorities said they found a list of people who had received the drink deliveries, They also recovered two vials of powdered substances, one black and one white.

Chief Timm said the police did not know why Ms. Dann had delivered the snacks to the two fraternities. Seven people who ate the snacks were later treated at local hospitals and released.

Sergeant Kalvaitis said an analysis of the snacks by a police laboratory showed that they ''contained a very heavy concentration of arsenic.''

The police believe that Ms. Dann was distraught Friday that the family that employed her as a baby sitter had an nounced plans to move out of state.

Four of the children wounded at Hubbard Woods Elementary School in this affluent northern suburb remained in critical condition today.

As details emerged about the bizarre final hours of Ms. Dann's life, hundreds of parents and children touched by the tragedy gathered at the school today to discuss the shootings and pray for the victims and Ms. Dann. Social workers talked privately with some of them. Threats and Odd Behavior

Laurie Dann left a long trail that led to Friday's rampage.

She had harassed an old boyfriend for two years with telephone calls.

Her former husband was stabbed with an ice pick as he slept one night in 1986. He suspected his former wife.

She had resided at an apartment complex in Madison where she was known for odd behavior. A former neighbor, Keith Wilson, said she was dubbed ''the elevator woman'' because she rode the elevator for extended periods, night and day, in the high-rise residence where she lived.

But the evidence that she was violent was thin, and proper procedures had to be followed. Her former boyfriend in Arizona refused to press charges. And some families Ms. Dann worked for as a baby sitter praised her work.

''If only we had known,'' said Dan Knauss, an assistant United States attorney in Tucson, Ariz. ''But you can't anticipate things like this.'' Woman Was Seeing Psychiatrist

Chief Timm said that Ms. Dann had been seeing a psychiatrist, but he gave no further details.

At some point, Chief Timm said, she obtained a license for a gun, one of three pistols she used Friday.

The authorities in Arizona said today they had been ready to indict Ms. Dann for making a threatening phone call to a man she had dated at the University of Arizona in the late 1970's.

Janet Johnson, another Federal prosecutor in Tucson, said the man had received harassing phone calls on and off since 1985 and on May 9 Ms. Dann threatened his life. But, fearing retaliation, he asked that the officials look for evidence that Ms. Dann had threatened others, so he would not be alone in pressing charges.

''We were not planning to dump the case, just trying to get some telephone calls from other jurisdictions,'' Ms. Johnson said. ''You need time to get those records, to prove an interstate connection. Trying to Follow Leads

''The F.B.I. had looked for her in Madison, but she had disappeared. We knew we were going to try to follow up leads, but she was lost so there wasn't much we could do.''

Ms. Dann, the daughter of a accountant, was reared in Glencoe, a nearby suburb. She came to the attention of Illinois authorities after she filed for divorce in 1986 from Russell Dann, an insurance agent.

Mr. Dann's parents, longtime Highland Park residents, also reported he had received threatening phone calls from the woman.",Hubbard Woods Elementary School,White,Police Still Unraveling Trail Left by Woman in Rampage
"WINNETKA, Ill., May 21— The Federal Bureau of Investigation knew about Lori Wasserman Dann. So did prosecutors in three states. So did her neighbors and her former husband and in-laws.

Prosecutors were trying to track her down and charge her with making harassing telephone calls and threats as she became increasingly disturbed, but they lost a race with time.

On Friday, the 30-year-old woman set fire to the house where she worked as a baby sitter, went to an elementary school and shot six children, killing one, then wounded a 20-year-old man in a nearby house and barricaded herself there.

The nine-hour ordeal ended Friday night when police discovered that Ms. Dann had fatally shot herself. Trail to Rampage

Authorities said Saturday they believe Ms. Dann also tried to deliver poison to several families she once worked for. Four of the children wounded at Hubbard Woods Elementary School in this affluent northern suburb of Chicago remained in critical condition today.

The police believe Ms. Dann had become distraught when a family that employed her as a baby sitter announced plans to move out of state.

Lori Dann left a long trail that led to Friday's rampage.

She had harassed an old boyfriend for two years with telephone calls.

Her former husband was stabbed with an ice pick as he slept one night in 1986. He suspected his former wife.

She had resided at an apartment complex in Madison, Wis., where she was known for odd behavior. A former neighbor, Keith Wilson, said she was dubbed ''the elevator woman'' because she rode the elevator for extended periods, night and day, in the high-rise residence where she lived. But the evidence that she was violent was thin, and proper procedures had to be followed. Her former boyfriend in Arizona refused to press charges. And some families Ms. Dann worked for as a baby sitter praised her work.

''If only we had known,'' said Dan Knauss, an assistant United States attorney in Tucson, Ariz. ''But you can't anticipate things like this.'' Woman Was Seeing Psychiatrist

Herbert Timm, Winnetka's police chief, said that Ms. Dann had been seeing a psychiatrist, but he gave no further details.

At some point, Chief Timm said, she obtained a license for a gun, one of three pistols she used Friday.

Authorities in Arizona said today they had been ready to indict Ms. Dann for making a threatening phone call to a man she had dated at the University of Arizona in the late 1970's.

Janet Johnson, another Federal prosecutor in Tucson, said the man had received harassing phone calls on and off since 1985 and on May 9 Ms. Dann threatened his life. But, fearing retaliation, he asked that the officials look for evidence that Ms. Dann had threatened others, so he would not be alone in pressing charges.

''We were not planning to dump the case, just trying to get some telephone calls from other jurisdictions,'' Ms. Johnson said. ''You need time to get those records, to prove an interstate connection.

''The F.B.I. had looked for her in Madison, but she had disappeared. We knew we were going to try to follow up leads, but she was lost so there wasn't much we could do.'' Ms. Dann, the daughter of a accountant, was reared in Glencoe, a nearby suburb. She came to the attention of Illinois authorities after she filed for divorce in 1986 from Russell Dann, an insurance agent.

Mr. Dann's parents, longtime Highland Park residents, also reported he had received threatening phone calls from the woman.",Hubbard Woods Elementary School,White,Long Trail Preceded Woman's Rampage in Illinois
"EVANSTON, Ill., May 22— A substitute teacher recounted today how she grabbed a deranged woman to stop her from shooting a classroom of second-grade youngsters on Friday.

''I just acted instinctually,'' said the teacher, Amy Moses. ''I just wanted to protect.''

The police described Ms. Moses, 29 years old, as a hero for her actions in a shooting rampage in the usually sedate northern Chicago suburb of Winnetka.

She was substitute teaching at Hubbard Woods Elementary School when the woman, Laurie Dan, 30, entered the room and shot five students, killing one and seriously injuring the others.

Moments earlier, Ms. Dann, a baby sitter with a history of bizarre behavior, had shot one youngster in a nearby bathroo.

She told Ms. Moses to herd the 24 children in her class together. Instead, Ms. Moses grabbed the woman's gun hand. But Ms. Dann pulled a second gun, sprayed the classroom with bullets and fled. 'Went on Automatic Pilot'

Police Chief Herbert Timm of Winnetka said that if Ms. Moses had followed the assailant's orders, ''We would have probably had all of the children shot.''

The chief called the teacher ''a hero.''

At a news conference today, Ms. Moses said: ''I really just went on automatic pilot,'' adding, ''I can't explain how unreal the whole situation was.''

Ms. Moses said the gun looked like a toy at first. But after the initial shot, she said, ''I was just frozen.

''When the first child went down, my first thought was, 'They're filming a movie and they forgot to tell me.' It wasn't until the second shot that we all realized it was real.''

She said the assailant's face was expressionless and hard.

The police also credited Ms. Moses with giving a full description of the assailant, who later barricaded herself in a suburban home where she wounded a college student and took her own life.

Ms. Moses said she planned to return to the school on Monday when a memorial service is planned for the youngster who died, Nicholas Corwin, 8.

''I love Hubbard Woods School,'' said Ms. Moses, who has worked there in various capacities for the last five years and is in the process of earning a master's degree in education.

''I know the faculty, the administration and a lot of the children and some of the parents,'' she said. ''I feel like the support system will be real helpful to me. The children and the families -everyone has been wonderful.''",Hubbard Woods Elementary School,White,Teacher Says She Acted on Instinct To Save Children in Shooting Spree
"WINNETKA, Ill., May 23— Eight-year-old Nicholas Corwin, slain in a woman's rampage through this Chicago suburb, was buried today after more than 1,000 mourners heard a rabbi say, ''We know that God is weeping.''

Later in the day children, teachers, counselors and parents gathered for a memorial service at Hubbard Woods Elementary School, where the child and five of his classmates were shot.

It was a gray day that mirrored the community's grief. Gov. James R. Thompson called for tightened handgun-control laws, although he said the public ''is never going to be protected against random, bizarre behavior.''

The youngster was fatally wounded when Laurie Dann, the daughter of a wealthy suburban family, stormed the school and fired on a second-grade classroom. Five students and a man who lived at a nearby house were wounded in the spree, which ended when the 30-year-old woman shot herself to death. Classes Are Canceled

''I think the adults will have a harder time letting go than our kids,'' said LaDonna Covelle, whose second-grade son, Mark, and daughter, Jennifer, a third grader, attend the school.

Classes were canceled at the school today and half a dozen police officers were outside.

''So deep is our sorrow, so great is our loss, that we know that God is weeping,'' said Rabbi Robert Schreibman at Nicholas's funeral service at Temple Jeremiah.

''The death of the young is always tragic, but this was so sudden, so swift - it was such an unexpected loss of a wonderful and promising child with so much to give,'' Rabbi Schreibman said.

Nicholas was buried at Memorial Park Cemetery in Skokie.

''Nicky was extremely well liked -loved,'' said Amy Moses, the 29-year-old substitute teacher who was in the classroom when the shooting occurred and tried to disarm Ms. Dann.

Before the shooting, Ms. Dann delivered tainted treats to two college fraternities and several homes where she had worked as a baby sitter. The police said no one was seriously injured by the poisoned fruit juice and cereal.

Ms. Dann was due to stand trial in Madison, Wis., on charges of shoplifting several women's wigs March 14. She also was being investigated by Federal authorities for making threatening telephone calls in three states to former friends and members of her ex-husband's family.

In an interview broadcast tonight, her ex-husband, Russell Dann, said the rampage might have been prevented.

''I hired attorneys,'' he said on the ABC-News program ''Nightline.'' ''I hired private detectives. This was the North Shore of Chicago reaching out for help, not just Russell Dann. I'm not saying we got no help, but Friday happened.''

He also said that ''on many occasions, we tried to get her arrested,'' but the police did not pursue her case actively enough.

The ''Nightline'' host, Ted Koppel, said Mr. Dann volunteered to appear on the program in the hope that he could prevent the repeat of another violent incident like the school shootings.

Photo of pall-bearers carrying coffin of Nicholas Corwin (AP)",Hubbard Woods Elementary School,White,SLAIN BOY BURIED
"WINNETKA, Ill., May 20— A woman wielding a pistol walked into an elementary school in this wealthy Chicago suburb today and opened fire apparently at random, killing an 8-year-old boy and critically wounding five other pupils.

She then fled to a nearby house and shot and wounded a 20-year-old occupant before the police arrived and surrounded the house and an adjoining wooded area. The police sealed off the area, surrounded it for about eight hours, then stormed it and found her dead. She ''apparently died by her own hand.'' said Chief Herbert Timm. The police stormed the house after efforts to communicate with her by bullhorn were unavailing, Chief Timm said.

The shootings and the subsequent police siege shattered the spring calm of this otherwise placid, lakefront suburb of 13,000 people north of Chicago. Squads of police officers armed with rifles crouched alongside the flowering shrubs and thick trees that line the community's narrow residential streets, and police helicopters clattered overhead. 'Mental and Assaultive Problems'

The police identified the suspect as Laurie Wasserman Dann, who is 31 years old and lived with her parents in nearby Glencoe. He said she was known to both police and Federal agents as a result of what he called a series of ''bizarre situations'' in recent years, but he to be more specific. He said that in a search of Ms. Dann's car the police recovered incendiary devices and ammunition.

Capt. David Frye of the police in Madison, Wis., where the suspect lived recently, said Ms. Dann had a history of ''mental and assaultive problems.''

Chief Timm said the police had not established a motive for the attacks and did not know whether the woman knew any of the children who were shot at the Hubbard Woods Elementary School. Reconstructed Events

The police said the shootings inside a second-grade classroom at the school were apparently part of a series of events that began this morning with a fire that had been deliberately set inside a house where Ms. Dann was employed as a baby sitter. The police, who said that residents of the house escaped the fire, pieced together the following account:

Shortly before 10:30 A.M. a woman the police believed to be Ms. Dann walked into the school and shot a pupil in a washroom. Then she walked down the hall and into a second-grade classroom, brandishing a .22 caliber pistol.

''This is a real gun,'' she announced. When a pupil asked her if that was true, she replied as she opened fire, ''Yes, and I'm going to show you.''

The suspect then fled several hundred feet along a path to a house, where she rushed inside, wielding two guns. ''She just came running in, out of breath,'' said Ruth Ann Andrews, who lives in the house. She said the woman struggled with her son, Philip, who was shot and wounded in the chest. He was hospitalized in critical condition. Pupils Kept Inside

Outside the one-story red brick school, a crowd of about 100 anxious parents gathered late this morning as news of the incident spread.

The authorities kept pupils inside at all Winnetka schools, including Hubbard Woods, until late afternoon as the police siege continued.

At Hubbard, Donald Moore, the schools superintendent, told parents that an emergency intervention team of social workers, clergy and psychiatrists from nearby hosptials were talking with children about what had happened.

Neighbors here told reporters that the family that employed Ms. Dann had recently told her than they were moving to New York and her services as a baby sitter would no longer be needed.

Neighbors said the family has five children, and that some of them were pupils at Hubbard Woods.

The dead pupil was identified as Nicholas B. Corwin, 8 years old, who was dead on arrival at Highland Park Hospital. Five other pupils, including three boys and two girls, were hospitalized and reported in critical condition.

Photo of a police officer in doorway of the classroom at the Hubbard Woods Elementary School in Winnetka, Ill. (AP); Parents of students waiting outside the school for their children to be released (AP); Laurie Wasserman Dann (AP)",Hubbard Woods Elementary School,White,"Slayer Found Dead After Attack on School Kills Boy, 8"
"CHICAGO, Sept. 22— A man ''who never said a word'' shot and killed two people in an auto parts store here today, then fatally wounded a police officer and a custodian at a nearby school before the police killed him.

A second officer and a city garbage man were also wounded before the man was slain at Montefiore School on the city's West Side, the Police Superintendent, LeRoy Martin, said.

The dead officer was Irma Ruiz, a 40-year-old mother of four who had been on the force 12 years, he said.

The gunman, Clemie Henderson, 40, who was described by a friend as full of anger since serving in Vietnam, had a history of battery complaints and drug use, Mr. Martin said. Clerk Pretended to be Shot

''I'm assuming he may have had some type of grievance, but I don't know,'' Mr. Martin said. ''All the witnesses state that this individual never said a word'' in the store.

At a news conference, Mr. Martin gave this account of the shootings:

Mr. Henderson walked into the Comet Auto Parts store at about 10 A.M. and shot and killed two clerks behind the counter, John Van Dyke, 41, and Robert Quinn, 26. Mr. Henderson missed a third clerk, who pretended to be hit and fell to the ground.

Mr. Henderson then walked out a side entrance, encountered the garbage man, Laplose Chestnut Jr., 34, and fired his .38-caliber pistol, wounding him in the hand.

Mr. Henderson then went to Montefiore, which serves about 135 troubled boys. He shot and killed a custodian, Arthur Baker, 33, outside the building.

At the door, he met Officer Ruiz and Officer Greg Jaglowski, 38, who had been called to the school to deal with an unruly pupil. Officer Ruiz was felled by a bullet to the chest, and Officer Jaglowski was hit in both legs.

''The offender retreated to a room,'' Mr. Martin said, where he ''reloaded with six fresh rounds.''

Back in the hall, he exchanged fire with Officer Jaglowski, who shot him twice in the chest. The police found 22 more rounds of ammunition on Mr. Henderson.

The Rev. C. Ferguson, who lives near the school, said he saw the gunman after he left the store and was headed toward the school. ''He said, 'Get out of the way, don't nobody move,' '' Mr. Ferguson said.

Students at the school were in classes during the incident, said the principal, Bernard Karlin.

Mr. Martin said that Mr. Henderson lived in the neighborhood and that the police found documents in his apartment indicating he worked as a model and hairdresser. They also found a picture of him dressed in military fatigues and holding an M-1 rifle.

A friend of Mr. Henderson's, David Finke, said the man had served as an Army combat infantryman in Vietnam in the late 1960's and early 1970's.

''I think it is fair to say he carried his disturbance from the Vietnam era into the present,'' said Mr. Finke, chairman of the Midwest Committee for Military Counseling. ''Something in these last few weeks just lost control of that.''

Hospital spokeswomen said Officer Jaglowski was in serious but stable condition with leg wounds and Mr. Chestnut was in good condition.

photo of officers removing body from store after gunman killed four people (AP)",Comet Auto Parts and Montefiore School,African American,Chicago Man Kills 4 and Wounds 2 Before Dying in a Shootout
"GREENWOOD, S.C., Sept. 26— A gunman walked into an elementary school today and opened fire, killing an 8-year-old girl and injuring 10 other people, the authorities said.

Police Chief James Coursey said James William Wilson, 19, of Greenwood, had been arrested and charged with murder, although no motive was known. Mr. Wilson was being held at the Greenwood Law Enforcement Center.

Mr. Coursey said that shortly after 11 A.M., Mr. Wilson entered Oakland Elementary School's front door, walked to the cafeteria, pulled a .22-caliber, nine-shot revolver from his belt and opened fire, injuring one teacher and three students. Teacher Shot in Mouth

Mr. Wilson left the cafeteria and entered a girl's restroom where Kat Finkbeiner attempted to prevent him from leaving after he reloaded, Mr. Coursey said. In the scuffle that followed, Ms. Finkbeiner was shot in the mouth and hand, he said.

Mr. Coursey said Mr. Wilson evaded Ms. Finkbeiner and entered a classroom two doors away, where he opened fire again, injuring five students and killing one.

After firing all the rounds in his pistol, Mr. Wilson dropped the weapon and Ms. Finkbeiner, unarmed, ordered him to raise his hands and stand until a police officer arrived.

The Superintendent of Schools, Bob Watson, said he knew of no connection between the assailant and the school.

''It appears to be an entirely random incident. The classroom was chosen randomly,'' Mr. Watson said.

The dead child was identified as Shequila Tawonn Bradley, said Odell Duvall, the Greenwood County Coroner. 'Offered No Resistance'

A physical education aide, Phillip Browning, said that after the suspect quit firing, he threw the pistol down as if nothing had happened. ''He remained calm and offered no resistance,'' Mr. Browning said.

The 10 injured people were taken to Self Memorial Hospital in Greenwood, where two pupils, Ms. Finkbeiner and another teacher remained hospitalized, said Dan Branyon, a spokesman. He said they suffered fractures and ''a number of gunshot wounds.''

A 7-year-old girl was in critical condition and undergoing surgery; the others were in fair condition, he said. Six students were treated and released by the hospital.

Mr. Watson said classes had been canceled for Tuesday and that children would receive counseling when they returned Wednesday.

Steve Brown, the Greenwood city manager, described the town's mood as very solemn.

''Everyone pretty much is saying they have read about these types of things in other areas but never thought it would happen in Greenwood,'' he said.

Gov. Carroll A. Campbell Jr. issued a statement of sympathy for the slain child's family and other victims and praised teachers for acting quickly to protect the students.

''Their actions possibly saved lives,'' the Governor said.

Map of South Carolina showing location of Greenwood (NYT)",Oakland Elementary,White,Gunman in S. Carolina School Kills 1 and Wounds 10 Others
