Article,Incident Name,Shooter Race,Title
"OKLAHOMA CITY, Aug. 21— Across a span of 27 years, old coaches remember Patrick Henry Sherrill as an earnest, quiet young football player who was ''a little bit shy.''

Teammates remember a strong, stocky youth who tried hard, made his high school team and won letters in three sports, but never quite reached star quality, though he made the first team as a defensive lineman after another player was hurt halfway through their senior season.

A lawyer who became his friend said she saw the expression of ''a lonely, abandoned child'' in eyes looking out of a bravely smiling countenance.

''Nobody could have been as shocked as I was at what happened,'' said Don Roberts, now of Houston, who was the quarterback on Mr. Sherrill's old team at Harding High School here.

Before and After Marine Corps

From such comments of old teammates, coaches, a friend and neighbors emerges the picture of a withdrawn youth, determined and painstaking, who went off to the Marine Corps and returned, still reclusive but imbued with a militaristic fervor, to wander the streets, peeking into homes and staring so strangely that children taunted him with the nickname Crazy Pat.

But no one, so far, has found a clue in his background that might have impelled Mr. Sherrill, at the age of 44, to take three weapons to a little post office a few miles north of here Wednesday and slay 14 of his fellow workers before taking his own life.

A day after his tragic rampage, the details of that life remain skimpy. Teammates knew that he lived alone with his mother. The next records indicate that he was a marine in the early 1960's but never, despite boasts to the contrary, went overseas.

Other reports give a sketchy employment record after his return from the Marines with training in electronics. There was apparently satisfactory work as a traffic-light technician for Oklahoma City, which he left for reasons that no one seems to know; work in the stockroom of the local American Cancer Society chapter, and a job he held briefly in a radio store. Quits After Imagined Insult

Mr. Sherrill left that job over what one fellow worker described as an imagined insult, because the owner referred to him as ''that young man.''

He had worked at the postal job for about a year and a half.

The police added an element to that picture today when they reported what they found at his home in a modest working-class neighborhood, where, unmarried, he had lived alone since the death of his mother about eight years ago. The house, the police said, had been dotted with guns and ammunition, ham radio and other electronic equipment, including a computer, literature about arms and electronics and literature on the Soviet Union.

Among the literature, said Lieut. Mike Wooldridge of the Edmond Police Department, were issues of Guns and Ammo magazine, Soviet Life magazines and a book, ''Russian Made Simple.''

It was impossible to tell whether the Russian literature fitted a recollection of his friend, the young lawyer, Janet Cox, who came to know Mr. Sherrill as one of her first clients when she handled a will about eight years ago, after the death of his mother. Friendly Toward Lawyer

After that he sporadically dropped by her office, Ms. Cox said, never seeking a date or any sort of sexual relationship but merely, she said, ''to keep in touch.''

''It was more a brother-sister kind of relationship - not even that,'' she said. ''I'd just got out of law school. He said he was proud I was making it. He'd say he was just in the neighborhood. He thought he would drop by to make sure I was all right.

''He always walked into my office with a smile, to cheer me up. He never talked about friends, and I had the impression he was extremely lonely. I do a lot of work with juveniles, and he had that look in his eyes, the kind I have seen in a lonely, abandoned child left by its parents.''

But the last time she had seen him, Ms. Cox said, Mr. Sherrill had seemed excited, saying he had an opportunity for a job that would take him abroad for two years.

What might have happened to that opportunity, if it existed, no one seemed to know, for he was known to be fearful of losing his postal job, a fear some believe set off his rampage. 'Passive Sort of Boy'

''He was easygoing, a passive sort of boy,'' said Byron Roberts,'' a former coach.

''I saw him at our 20th reunion,'' said the coach's son, Don Roberts. ''He just seemed quiet, easygoing, normal. He smiled a lot. But he was a loner.''

Most neighbors, except Jane Thompson, remember a different Pat Sherrill. Miss Thompson, who lives across the street from the Sherrill home, remembers Mr. Sherrill, after his Marine Corps service, sitting for hours in her house, apparently seeking the company of her family.

Like her neighbors, she remembered him riding around the neighborhood on a ''bicycle built for two - never with anybody in the second seat.''

Also, like her neighbors, she said he had gained the reputation of a peeping Tom, wandering across lawns ''at all hours of the night.''

''And he would just stare at you, with such a strange look, like he was laughing at you,'' she said. ''It was terrifying.''

When she was about 11, said Miss Thompson, who is now 26, ''every night I'd wake up and there would be Pat standing at the window.''

Recently, she said, she discovered that Mr. Sherrill had had a telescope trained on her front window, ''but not for reasons you might think.'' Nobody dressed or undressed in that room, she said.","Edmond, Oklahoma Post Office",White,FROM SHY FOOTBALL PLAYER TO 'CRAZY PAT'
"EDMOND, Okla., Aug. 21— Amid tears and embraces, glassy stares and wrenching sobs, postal workers returned to their jobs here this morning, a day after a co-worker unleashed a murderous 10-minute barrage that killed 14 people.

Police investigators said Patrick Henry Sherrill, a 44-year-old letter carrier, cooked himself scrambled eggs for breakfast and cleaned the dishes Wednesday before driving to work and methodically gunning down workers at the five-year-old brick postal center here. He then killed himself. Conflicts on Labor Relations

The police said the supervisor who had criticized Mr. Sherrill the day before over his performance, Bill Bland, was not at work at the time of the shootings because he had overslept. Another supervisor who was with Mr. Bland in his meeting with Mr. Sherrill was among the dead, the police said.

There were conflicting reports of the severity of disciplinary measures against Mr. Sherrill and of labor relations at postal facilities in the area. Union officials criticized labor relations in the region but said working conditions and management at the Edmond postal center were far better than in other offices.

For most workers, such questions were all but insignificant as they greeted friends who survived, mourned those who did not and tried to resume their lives here.

''We're close here - I mean we all love each other, we really do,'' said Karleen White, a 34-year-old carrier from Cashion, Okla. ''I don't think we'll ever go back to the job as if nothing happened. Everyone is just so hurt.''

As work resumed and residents of this Oklahoma City suburb of 43,000 people brought dozens of floral arrangements and condolence cards to the post office, the police and postal officials continued investigating the incident.

Both the police and postal officials said that on the day before the shootings, Mr. Sherrill's job performance was criticized by his supervisor, Mr. Bland. Attending the meeting was another supervisor, Rick Esser, who was one of the first ones shot and killed Wednesday. 'Counseling' or More

Mr. Bland, who returned to work today, could not be reached for comment. The police said he had told them he had threatened Mr. Sherrill with dismissal if his work did not improve. But postal officials with the Edmond office, who said they had also spoken with Mr. Bland, reported that there had been no threat of dismissal and that the meeting was classified as a ''counseling'' session, the lowest level of corrective action.

They said Mr. Sherrill had been disciplined in the past for poor performance. But they declined to specify how many times he had been disciplined or for what, saying the United States Attorney's office in Oklahoma City had advised them to withhold information on Mr. Sherrill's work.

John E. Green, first assistant United States Attorney for the Western District of Oklahoma, said the information was being withheld pending a full investigation. He said it might be a week before a full report was available.

The 24,000-square-foot Edmond postal facility is a post office and distribution center that serves 68,000 people in towns and rural routes over 278 square miles outside Oklahoma City, officials said. It employs about 120 workers. 'Incentive to Work Harder'

Local postal union officials had said Wednesday that efforts to increase postal efficiency had led to intimidation and harassment of some workers throughout the Oklahoma City area and that grievance complaints for the region were running at record levels.

An Edmond union steward, Ron Blackwell, said in an interview today that management pressure could have played a role in the shootings. ''I don't think it helped any,'' said Mr. Blackwell, one of those who escaped the gunfire. ''There is always the incentive to work harder and get maximum performance out of people. They can get a little pushy.''

David Landis, vice president of the National Association of Letter Carriers' Branch 458, the Oklahoma City union local that includes Edmond, said that there was increasing pressure on workers throughout the area but that Edmond had one of the best labor records of area post offices. ''If this had happened in a lot of offices it would not have surprised me at all,'' he said. ''But not in Edmond.'' Dick Carleton, general manager for the Oklahoma division of the United States Postal Service, said, ''If there were so many problems, would you have everyone showing up for work on a day after a tragedy? Would they come in here and console each other and voluntarily come and do their jobs? I think that's a good question.'' 'He Couldn't Do the Job'

Several workers described Mr. Sherrill as a loner with a reputation for poor work and faulted him alone, not management, for the incident.

''The guy couldn't carry mail - he couldn't do the job,'' said Ms. White, who is not a union member. ''I think if anything the union is partly to blame. I think sometimes they protect too much. This guy should have been gone a long time ago. You can ask anybody. This guy was goofy.'' The police were trying to determine today if Mr. Sherrill had left any sort of a note explaining his actions. They said his home in Oklahoma City was cluttered with weapons, ammunition, books, magazines and electronics, including computer equipment, citizens' band and ham radios, and police scanners.

Officers said a woman whom they declined to identify had told them that she had talked to Mr. Sherrill, her friend, the night before the shooting and that he had asked numerous questions about grammar, leading them to think he had written a note. But none was found today. 'Performed Like Champions'

Postal officials said virtually all the workers scheduled to work today had shown up.

''They came in here and performed like champions,'' said Bill Shockey, the former Edmond postmaster. ''I couldn't be more proud of any group of people I have ever been associated with.'' Mr. Shockey, who is now the safety and health services manager for the postal division with headquarters in Oklahoma City, spent much of the day at the Edmond office.

The emotions were not limited to employees.

By midafternoon the post office lobby was filled with flowers brought by local residents, and at least two dozen wreaths and floral arrangements had been placed at the base of the American flag that flew at half-staff in front of the building.

''Most people want to do something,'' said Brian Fields, a 22-year-old commercial artist who brought a condolence card he had made to the post office this afternoon. ''That's the one nice thing you can say about this. At least people really care.''

Photo of flowers on lawn outside post office (AP); Photo of Edmond residents at memorial service (The Daily Oklahoman via AP); Photo of Lorrene Christian comforting co-worker (AP)","Edmond, Oklahoma Post Office",White,WORKERS RETURN TO SLAYING SCENE
"OKLAHOMA CITY, Aug. 20— The words ''loner,'' ''strange'' and ''weird'' came up again and again as neighbors and fellow workers described Patrick Henry Sherrill, whose wild rampage left 15 people dead here today.

They recalled how the behavior of the tall, husky and nearly bald former marine had grown increasingly strange.

People who knew the 44-year-old former high school athlete described how he returned home from two years of service in the 1960's addicted to guns, live ammunition and military apparel he brought home with him.

Mr. Sherrill, who was never married, lived here alone in a house he had shared with his mother before her recent death.

Always in Fatigues

''Whenever you'd see him when he first came home, he'd always be in those Army fatigues,'' said Charles Thompson, 25, who was growing up in the same northwest Oklahoma City neighborhood streets that Mr. Sherrill walked as a returned veteran.

''At first he was pretty nice to us kids,'' said Mr. Thompson. ''He even played ball with us once in his backyard. Once. It never happened again.''

But, always a ''loner,'' Mr. Sherrill began to exhibit increasingly ''strange'' behavior, and the boys developed nicknames for him.

''We had two names for him, 'Fat Pat' and 'Crazy Pat,''' Mr. Thompson said.

Those names came, Mr. Thompson said, after the boys began to see Mr. Thompson wandering streets at night and peering into neighbors' homes. Peeping in Windows

''We caught him right up at the windows, peeping,'' Mr. Thompson said.

''He'd be seen in this neighborhood walking around at all hours of the night, walking right across lawns,'' said Gerald Cash, another neighbor.

And in the daytime ''he'd stand and look at you, just stare at you and not say a word,'' Mr. Cash said.

Although his service records in the Marine Corps and later with the Air National Guard, where he was an instructor in the handling and care of small arms, show no evidence of disciplinary problems, his work record showed some evidence of behavioral deterioration.

As an employee of Oklahoma City for a brief period, he worked satisfactorily as an electronics technician on traffic lights, a former superior said.

And at a local chapter of the American Cancer Society, where he held a job in the stock room, obtained through a sister, he was said again to have performed satisfactorily. 'That Young Man'

But Mr. Sherrill, a ham radio operator whose house was filled with electronic equipment, quit a job in a radio store seven years ago because the owner had referred to him as a ''young man,'' a fellow employee there said.

A customer, according to the employee's account, was told that he would be served by ''that young man,'' whereupon Mr. Sherrill said he had a name and that it was Pat Sherrill.

''I turned around and the customer was gone and so was Sherrill,'' the employee said.

Mr. Sherrill did not form bonds with other ham radio operators. One who knew Mr. Sherrill a few years ago but asked not to be identified said Mr. Sherrill had once been refused membership in a local amateur radio club.

''He wasn't well liked by anybody in the ham radio community,'' the radio operator said. ''He never got close to any of us.''

Mr. Sherrill worked for about a year and a half at the post office at nearby Edmond, where the killings occurred, but had ''discipline'' problems, according to Richard Carleton, a supervisor, and had been suspended at least once.

''He had a history of discipline,'' said Mr. Carleton, and he had been ''talked to'' as recently as Tuesday.

According to Roger Nelson, a letter carrier, ''He was not the kind of guy you'd get to know very well.''

Neighbors said the police took large quantities of ammunition today out of the little white house where Mr. Sherrill lived, in a modest community of small but neatly kept white homes, But that surprised no one, Mr. Thompson said. ''There were always guns and live ammunition and hand grenades lying around that house,'' he said.","Edmond, Oklahoma Post Office",White,"TO NEIGHBORS, KILLER WAS 'CRAZY PAT'"
"EDMOND, Okla., Aug. 20— A mail carrier in trouble with his supervisors opened fire in a crowded post office here early this morning, killing 14 workers and injuring 7 others before killing himself with a bullet in the head.

The police said the carrier, Patrick Henry Sherrill, of Oklahoma City, burst into the rambling, one-story post office here about 6:45 A.M., pulled at least three pistols from a mail pouch and, without a word, started shooting at his fellow employees.

''He was in the center of the room with two .45's, blazing away,'' said Larry J. Vercelli, a postal union supervisor who talked with some of the employees after they had fled when the shooting began. One Shot in Parking Lot

The police said one worker was shot in the parking lot behind the five-year-old brick post office. The police said they believed Mr. Sherrill shot the worker before entering the building and then tried to lock the back doors before unleashing his barrage on approximately 100 workers sorting mail and preparing for the day's deliveries.

Police SWAT teams found Mr. Sherrill and 14 fellow employees shot to death when they entered the post office about 8:30 A.M. after trying in vain to talk to the gunman. Seven others were treated at nearby hospitals for bullet wounds; two of the wounded were listed in critical condition. They were being treated at Edmond Memorial Hospital here and at Mercy Health Center in Oklahoma City.

It was the nation's worst shooting since July 18, 1984, when 21 people, including the gunman, died at a McDonald's restaurant in San Ysidro, Calif.

In Washington, Postmaster General Preston R. Tisch ordered flags flown at half staff at all post offices. A spokesman for Mr. Tisch was calling the families of all the victims to express his sorrow and offer assistance.

Ernest Bingham, an 18-year postal veteran who said he helped train Mr. Sherrill, said that when the shooting began, no one knew what was happening. But when he looked up toward the supervisor's desk, he saw two bodies lying on the floor.

''That's when I leaped over the counter and out the front door,'' he said. ''All I could think was getting out of there. There were several that didn't.''

The police said they received word of the shooting shortly after 7 o'clock, and were at the scene within minutes. Police officers said they heard two more shots from inside the building when they arrived at the post office. 'There Was a Lot of Blood'

The police said they tried to reach the gunman by telephone and through megaphones and other speakers until about 8:30 A.M., when SWAT teams entered the building. They said no shots were fired after they entered.

''There was a lot of blood, a lot of bodies,'' said Police Lieut. Mike Woolridge of the Edmond Police Department. ''With 14 people, you're going to have a lot of blood.''

The police said Mr. Sherrill, a 44-year-old part-time letter carrier who had worked at the post office for about a year and a half, had apparently received unfavorable performance ratings and was afraid of losing his job. He telephoned union officials twice on Tuesday, demanding that he be transferred to Oklahoma City, union officials said.

Postal officials here said Mr. Sherrill was reprimanded by a supervisor for poor performance that day. Pressure to Increase Productivity

Local union officials said there had been increasing friction between mail carriers and management in recent months as a result of a Postal Service realignment. They said there was extraordinary pressure, even harassment, to increase productivity.

While expressing shock over the shootings, the officials said they believed the increasing pressure on workers contributed to today's tragedy. Mr. Sherrill had been sharply reprimanded and threatened with dismissal the previous day, they said.

''A few of us were talking about it a few weeks ago and someone said that one of these day someone is going to go off the nut and shoot somebody,'' said Bob Bearden, the local union's recording secretary. ''This is not an isolated incident. There have been other confrontations. Most people can let off steam and then walk away. This time it was taken to the ultimate.'' No local postal authorities could be reached immediately for comment. Vincent R. Sombrotto, president of the National Association of Letter Carriers, said in Washington that his union had received an unusually high number of complaints about management in the Oklahoma City area, including the Edmond facility.

Those complaints involved allegations of verbal abuse, including threats of discipline and dismissal, according to Mr. Sombrotto. He said he got the reports from local union officials. Remarks Termed 'Disgraceful'

Bob Becker, director of news and public affairs for the United States Postal Service in Washington, said he would not comment on labor-management relations in post offices in Oklahoma or elsewhere, but added that Mr. Sombrotto's remarks ''border on the disgraceful.''

''We have been in contact with Mr. Sombrotto all day long,'' Mr. Becker said. ''It's obvious he doesn't have all the facts. I think that statements like that in a time of terrible tragedy are irresponsible at best.''","Edmond, Oklahoma Post Office",White,"MAIL CARRIER KILLS 14 IN POST OFFICE, THEN HIMSELF"
"LEWISTOWN, Mont., Dec. 5— A 14-year-old student shot to death a teacher and wounded a vice principal and two classmates at his high school today, then fled to his home where his parents turned him over to the police, the authorities said.

The student, who was armed with a large-caliber revolver, shot the teacher in the face at Fergus High School then ran into a hall and out the school, firing as he went, said Tom Killham, an assistant police chief.

The teen-ager ran more than a mile to his home with the police in pursuit, and officers surrounded the house, Mr. Killham said.

'Parents Surrendered Him'

''Telephone contact was made with the suspect's parents,'' Mr. Killham said. ''His parents surrendered him shortly after that.''

The youth was identified by Fergus County Attorney Craig Buehler as Kristofor Hans.

The teen-ager was booked on a charge of deliberate homicide and was taken to a juvenile facility in Billings, 130 miles away, Mr. Buehler said. No motive was disclosed for the shootings, which occurred about 1:20 P.M.

The teacher, Henrietta Smith, 40 years old, who was a substitute, was pronounced dead at the school, said the Fergus county coroner, Jerry Cloyd.

After shooting Ms. Smith, the assailant ran out of the classroom and fired three more times before fleeing the building, Mr. Killham said. The vice principal, John Moffatt, was hit in the abdomen and two students suffered minor injuries, Mr. Killham said.

The assailant, after wounding Mr. Moffat ''turned back and shot at the staff person a second time,'' Mr. Killham said. ''As he left the building, he turned and shot back at the school building.'' Town of 7,000 People

The wounded students, seniors in a different classroom, were injured by shrapnel, Mr. Killham said.

Mr. Moffatt underwent surgery at the Central Montana Hospital in this agricultural community of about 7,000 people, which is midway between Billings and Great Falls.

A girls' basketball tournament was under way at the time of the shooting but it occurred away from the gymnasium and the tournament was not disrupted, according to Police Chief Russell Dunnington.

Students had been excused from class because of the tournament, a school employee said.

A number of other students and staff members in the school were taken to the auditorium immediately after the shooting, and stayed there until the assailant was captured, said Bob Raver, the high school principal.

School was scheduled Friday, with staff and additional counselors to help students deal with psychological reaction to the shootings.",Fergus County High School,White,"YOUTH, 14, IS HELD"
